{
  "anchors": {
    "ap_primary": {
      "kind": "AP",
      "location": {
        "column": 9,
        "file": "cases/116_joint_inputs_may_v5.cpp",
        "line": 28
      },
      "token": "ap_primary"
    },
    "node_joint_guard": {
      "kind": "NODE",
      "location": {
        "column": 9,
        "file": "cases/116_joint_inputs_may_v5.cpp",
        "line": 26
      },
      "token": "node_joint_guard"
    },
    "source_gate": {
      "kind": "SOURCE",
      "location": {
        "column": 9,
        "file": "cases/116_joint_inputs_may_v5.cpp",
        "line": 24
      },
      "token": "source_gate"
    },
    "source_left": {
      "kind": "SOURCE",
      "location": {
        "column": 9,
        "file": "cases/116_joint_inputs_may_v5.cpp",
        "line": 20
      },
      "token": "source_left"
    },
    "source_right": {
      "kind": "SOURCE",
      "location": {
        "column": 9,
        "file": "cases/116_joint_inputs_may_v5.cpp",
        "line": 22
      },
      "token": "source_right"
    }
  },
  "aps": [
    {
      "expression": "source_left > 8 and source_right < 14",
      "id": "ap_primary",
      "location": {
        "column": 9,
        "file": "cases/116_joint_inputs_may_v5.cpp",
        "line": 28
      },
      "role": "GUARD",
      "symbol": "ap_primary"
    }
  ],
  "case_id": "RIFT-GOLD-116",
  "case_relation": "MAY_INFLUENCE",
  "category": "joint_inputs",
  "entry_point": "main",
  "human_validation": {
    "arbitration_required": true,
    "note": "Real-project labels require two independent human annotations and arbitration; none are claimed here.",
    "required_annotators": 2,
    "status": "PENDING"
  },
  "language": "c++20",
  "oracle": {
    "derivation": "The AP is a conjunction whose truth-change requires satisfying regions for both inputs; the oracle records the joint group instead of pretending either mutation is sufficient alone.",
    "generator_version": "1.0.0",
    "kind": "MECHANICAL_TEMPLATE_ORACLE",
    "limitations": [
      "The oracle is exact only for the generated template and declared source/AP pairs.",
      "Compilation does not independently prove semantic influence or mutation effectiveness."
    ],
    "template_id": "joint_inputs",
    "variant": 5
  },
  "relations": [
    {
      "ap_id": "ap_primary",
      "channels": [
        "control",
        "data"
      ],
      "joint_group": [
        "source_left",
        "source_right"
      ],
      "mutation_recipe": {
        "direction": "mutate with the other operand held in its satisfying region",
        "kind": "joint_boundary",
        "relative_time_window": null,
        "suggested_values": [
          "8",
          "9",
          "13",
          "14"
        ]
      },
      "negative_reason": null,
      "path": {
        "edges": [
          {
            "certainty": "may",
            "from": "source_left",
            "kind": "control",
            "to": "node_joint_guard"
          },
          {
            "certainty": "may",
            "from": "node_joint_guard",
            "kind": "data",
            "to": "ap_primary"
          }
        ],
        "nodes": [
          "source_left",
          "node_joint_guard",
          "ap_primary"
        ]
      },
      "preconditions": [
        "the other joint operand satisfies its guard",
        "source_gate != 0"
      ],
      "relation": "MAY_INFLUENCE",
      "source_id": "source_left"
    },
    {
      "ap_id": "ap_primary",
      "channels": [
        "control",
        "data"
      ],
      "joint_group": [
        "source_left",
        "source_right"
      ],
      "mutation_recipe": {
        "direction": "mutate with the other operand held in its satisfying region",
        "kind": "joint_boundary",
        "relative_time_window": null,
        "suggested_values": [
          "8",
          "9",
          "13",
          "14"
        ]
      },
      "negative_reason": null,
      "path": {
        "edges": [
          {
            "certainty": "may",
            "from": "source_right",
            "kind": "control",
            "to": "node_joint_guard"
          },
          {
            "certainty": "may",
            "from": "node_joint_guard",
            "kind": "data",
            "to": "ap_primary"
          }
        ],
        "nodes": [
          "source_right",
          "node_joint_guard",
          "ap_primary"
        ]
      },
      "preconditions": [
        "the other joint operand satisfies its guard",
        "source_gate != 0"
      ],
      "relation": "MAY_INFLUENCE",
      "source_id": "source_right"
    },
    {
      "ap_id": "ap_primary",
      "channels": [
        "control",
        "data"
      ],
      "joint_group": [
        "source_left",
        "source_right",
        "source_gate"
      ],
      "mutation_recipe": {
        "direction": "enable joint predicate",
        "kind": "joint_enable",
        "relative_time_window": null,
        "suggested_values": [
          "0",
          "1"
        ]
      },
      "negative_reason": null,
      "path": {
        "edges": [
          {
            "certainty": "may",
            "from": "source_gate",
            "kind": "control",
            "to": "node_joint_guard"
          },
          {
            "certainty": "may",
            "from": "node_joint_guard",
            "kind": "data",
            "to": "ap_primary"
          }
        ],
        "nodes": [
          "source_gate",
          "node_joint_guard",
          "ap_primary"
        ]
      },
      "preconditions": [],
      "relation": "MAY_INFLUENCE",
      "source_id": "source_gate"
    }
  ],
  "schema_version": "rift.mechanical-gold.case.v1",
  "source_file": "cases/116_joint_inputs_may_v5.cpp",
  "source_sha256": "53ba55c60c933e7aeb003ecddfe2f373d34a102ed9ca54bfb5600f07420a779f",
  "sources": [
    {
      "controllability": "EXTERNAL",
      "fuzzable_frontier": true,
      "id": "source_left",
      "kind": "external_argument",
      "location": {
        "column": 9,
        "file": "cases/116_joint_inputs_may_v5.cpp",
        "line": 20
      },
      "scope": "SESSION",
      "symbol": "source_left"
    },
    {
      "controllability": "EXTERNAL",
      "fuzzable_frontier": true,
      "id": "source_right",
      "kind": "external_argument",
      "location": {
        "column": 9,
        "file": "cases/116_joint_inputs_may_v5.cpp",
        "line": 22
      },
      "scope": "SESSION",
      "symbol": "source_right"
    },
    {
      "controllability": "EXTERNAL",
      "fuzzable_frontier": true,
      "id": "source_gate",
      "kind": "setup_operation",
      "location": {
        "column": 9,
        "file": "cases/116_joint_inputs_may_v5.cpp",
        "line": 24
      },
      "scope": "SESSION",
      "symbol": "source_gate"
    }
  ]
}
