{
  "anchors": {
    "ap_primary": {
      "kind": "AP",
      "location": {
        "column": 9,
        "file": "cases/024_control_only_must_v3.cpp",
        "line": 24
      },
      "token": "ap_primary"
    },
    "source_primary": {
      "kind": "SOURCE",
      "location": {
        "column": 9,
        "file": "cases/024_control_only_must_v3.cpp",
        "line": 20
      },
      "token": "source_primary"
    }
  },
  "aps": [
    {
      "expression": "branch-selected Boolean",
      "id": "ap_primary",
      "location": {
        "column": 9,
        "file": "cases/024_control_only_must_v3.cpp",
        "line": 24
      },
      "role": "GUARD",
      "symbol": "ap_primary"
    }
  ],
  "case_id": "RIFT-GOLD-024",
  "case_relation": "MUST_INFLUENCE",
  "category": "control_only",
  "entry_point": "main",
  "human_validation": {
    "arbitration_required": true,
    "note": "Real-project labels require two independent human annotations and arbitration; none are claimed here.",
    "required_annotators": 2,
    "status": "PENDING"
  },
  "language": "c++20",
  "oracle": {
    "derivation": "The positive templates place the source only in a branch predicate, never in the assigned AP data value; negative variants remove that predicate dependence.",
    "generator_version": "1.0.0",
    "kind": "MECHANICAL_TEMPLATE_ORACLE",
    "limitations": [
      "The oracle is exact only for the generated template and declared source/AP pairs.",
      "Compilation does not independently prove semantic influence or mutation effectiveness."
    ],
    "template_id": "control_only",
    "variant": 3
  },
  "relations": [
    {
      "ap_id": "ap_primary",
      "channels": [
        "control"
      ],
      "joint_group": [],
      "mutation_recipe": {
        "direction": "cross guard boundary",
        "kind": "guard_flip",
        "relative_time_window": null,
        "suggested_values": [
          "6",
          "7"
        ]
      },
      "negative_reason": null,
      "path": {
        "edges": [
          {
            "certainty": "must",
            "from": "source_primary",
            "kind": "control",
            "to": "ap_primary"
          }
        ],
        "nodes": [
          "source_primary",
          "ap_primary"
        ]
      },
      "preconditions": [],
      "relation": "MUST_INFLUENCE",
      "source_id": "source_primary"
    }
  ],
  "schema_version": "rift.mechanical-gold.case.v1",
  "source_file": "cases/024_control_only_must_v3.cpp",
  "source_sha256": "4f3e4fc6396cfe383eb9794c5856f61c2c125338461dd13bedc434964562dc9f",
  "sources": [
    {
      "controllability": "EXTERNAL",
      "fuzzable_frontier": true,
      "id": "source_primary",
      "kind": "external_argument",
      "location": {
        "column": 9,
        "file": "cases/024_control_only_must_v3.cpp",
        "line": 20
      },
      "scope": "PROCESS",
      "symbol": "source_primary"
    }
  ]
}
