{
  "anchors": {
    "ap_primary": {
      "kind": "AP",
      "location": {
        "column": 13,
        "file": "cases/054_message_parser_state_must_v3.cpp",
        "line": 31
      },
      "token": "ap_primary"
    },
    "node_message": {
      "kind": "NODE",
      "location": {
        "column": 31,
        "file": "cases/054_message_parser_state_must_v3.cpp",
        "line": 27
      },
      "token": "node_message"
    },
    "node_state": {
      "kind": "NODE",
      "location": {
        "column": 13,
        "file": "cases/054_message_parser_state_must_v3.cpp",
        "line": 29
      },
      "token": "node_state"
    },
    "source_message_value": {
      "kind": "SOURCE",
      "location": {
        "column": 13,
        "file": "cases/054_message_parser_state_must_v3.cpp",
        "line": 25
      },
      "token": "source_message_value"
    }
  },
  "aps": [
    {
      "expression": "parsed state > 3",
      "id": "ap_primary",
      "location": {
        "column": 13,
        "file": "cases/054_message_parser_state_must_v3.cpp",
        "line": 31
      },
      "role": "STATE",
      "symbol": "ap_primary"
    }
  ],
  "case_id": "RIFT-GOLD-054",
  "case_relation": "MUST_INFLUENCE",
  "category": "message_parser_state",
  "entry_point": "main",
  "human_validation": {
    "arbitration_required": true,
    "note": "Real-project labels require two independent human annotations and arbitration; none are claimed here.",
    "required_annotators": 2,
    "status": "PENDING"
  },
  "language": "c++20",
  "oracle": {
    "derivation": "A typed message, parser predicate, and state commit make the field-to-state path explicit; the negative template uses a parser-ignored field.",
    "generator_version": "1.0.0",
    "kind": "MECHANICAL_TEMPLATE_ORACLE",
    "limitations": [
      "The oracle is exact only for the generated template and declared source/AP pairs.",
      "Compilation does not independently prove semantic influence or mutation effectiveness."
    ],
    "template_id": "message_parser_state",
    "variant": 3
  },
  "relations": [
    {
      "ap_id": "ap_primary",
      "channels": [
        "field",
        "parse",
        "state_commit"
      ],
      "joint_group": [],
      "mutation_recipe": {
        "direction": "cross parsed state boundary",
        "kind": "message_field_boundary",
        "relative_time_window": null,
        "suggested_values": [
          "3",
          "4"
        ]
      },
      "negative_reason": null,
      "path": {
        "edges": [
          {
            "certainty": "must",
            "from": "source_message_value",
            "kind": "field",
            "to": "node_message"
          },
          {
            "certainty": "must",
            "from": "node_message",
            "kind": "parse",
            "to": "node_state"
          },
          {
            "certainty": "must",
            "from": "node_state",
            "kind": "state_commit",
            "to": "ap_primary"
          }
        ],
        "nodes": [
          "source_message_value",
          "node_message",
          "node_state",
          "ap_primary"
        ]
      },
      "preconditions": [],
      "relation": "MUST_INFLUENCE",
      "source_id": "source_message_value"
    }
  ],
  "schema_version": "rift.mechanical-gold.case.v1",
  "source_file": "cases/054_message_parser_state_must_v3.cpp",
  "source_sha256": "ca8b349427b2298e59a0936e49586878b781fbf03dcf09189e906193336a9bb4",
  "sources": [
    {
      "controllability": "EXTERNAL",
      "fuzzable_frontier": true,
      "id": "source_message_value",
      "kind": "message_field",
      "location": {
        "column": 13,
        "file": "cases/054_message_parser_state_must_v3.cpp",
        "line": 25
      },
      "scope": "SESSION",
      "symbol": "source_message_value"
    }
  ]
}
